{
  "id": "real-time-finance",
  "protocol_version": "0.2.0",
  "identity": {
    "name": "Real Time Finance",
    "purpose": "Websocket API to access realtime stock data"
  },
  "offers": [
    {
      "intent": "use_api",
      "description": "가상의 기본 엔드포인트: https://github.com/Real-time-finance/finance-websocket-API/",
      "endpoint": "/",
      "method": "GET",
      "side_effect": "read-only",
      "auth_type": "api_key",
      "confidence_score": 0.5
    }
  ],
  "needs": [
    {
      "intent": "identity.api_key",
      "criticality": "required"
    }
  ]
}