{
  "id": "serialif-color",
  "protocol_version": "0.2.0",
  "identity": {
    "name": "Serialif Color",
    "purpose": "Color conversion, complementary, grayscale and contrasted text"
  },
  "offers": [
    {
      "intent": "use_api",
      "description": "가상의 기본 엔드포인트: https://color.serialif.com/",
      "endpoint": "/",
      "method": "GET",
      "side_effect": "read-only",
      "auth_type": "api_key",
      "confidence_score": 0.5
    }
  ],
  "needs": [
    {
      "intent": "identity.api_key",
      "criticality": "required"
    }
  ]
}