{
  "id": "smart-image-enhancement-api",
  "protocol_version": "0.2.0",
  "identity": {
    "name": "Smart Image Enhancement API",
    "purpose": "Performs image upscaling by adding detail to images through multiple super-resolution algorithms"
  },
  "offers": [
    {
      "intent": "use_api",
      "description": "가상의 기본 엔드포인트: https://apilayer.com/marketplace/image_enhancement-api",
      "endpoint": "/",
      "method": "GET",
      "side_effect": "read-only",
      "auth_type": "api_key",
      "confidence_score": 0.5
    }
  ],
  "needs": [
    {
      "intent": "identity.api_key",
      "criticality": "required"
    }
  ]
}