{
  "id": "compare-flight-prices",
  "protocol_version": "0.2.0",
  "identity": {
    "name": "Compare Flight Prices",
    "purpose": "API for comparing flight prices across platforms"
  },
  "offers": [
    {
      "intent": "use_api",
      "description": "가상의 기본 엔드포인트: https://rapidapi.com/obryan-software-obryan-software-default/api/compare-flight-prices/",
      "endpoint": "/",
      "method": "GET",
      "side_effect": "read-only",
      "auth_type": "api_key",
      "confidence_score": 0.5
    }
  ],
  "needs": [
    {
      "intent": "identity.api_key",
      "criticality": "required"
    }
  ]
}