{
  "id": "tisane",
  "protocol_version": "0.2.0",
  "identity": {
    "name": "Tisane",
    "purpose": "Text Analytics with focus on detection of abusive content and law enforcement applications"
  },
  "offers": [
    {
      "intent": "use_api",
      "description": "가상의 기본 엔드포인트: https://tisane.ai/",
      "endpoint": "/",
      "method": "GET",
      "side_effect": "read-only",
      "auth_type": "api_key",
      "confidence_score": 0.5
    }
  ],
  "needs": [
    {
      "intent": "identity.api_key",
      "criticality": "required"
    }
  ]
}