{
  "id": "cloudmersive-natural-language-processing",
  "protocol_version": "0.2.0",
  "identity": {
    "name": "Cloudmersive Natural Language Processing",
    "purpose": "Natural language processing and text analysis"
  },
  "offers": [
    {
      "intent": "use_api",
      "description": "가상의 기본 엔드포인트: https://www.cloudmersive.com/nlp-api",
      "endpoint": "/",
      "method": "GET",
      "side_effect": "read-only",
      "auth_type": "api_key",
      "confidence_score": 0.5
    }
  ],
  "needs": [
    {
      "intent": "identity.api_key",
      "criticality": "required"
    }
  ]
}