{
  "id": "transport-for-sao-paulo--brazil",
  "protocol_version": "0.2.0",
  "identity": {
    "name": "Transport for Sao Paulo, Brazil",
    "purpose": "SPTrans"
  },
  "offers": [
    {
      "intent": "use_api",
      "description": "가상의 기본 엔드포인트: http://www.sptrans.com.br/desenvolvedores/api-do-olho-vivo-guia-de-referencia/documentacao-api/",
      "endpoint": "/",
      "method": "GET",
      "side_effect": "read-only",
      "auth_type": "api_key",
      "confidence_score": 0.5
    }
  ],
  "needs": [
    {
      "intent": "identity.api_key",
      "criticality": "required"
    }
  ]
}