{
  "id": "climatiq",
  "protocol_version": "0.2.0",
  "identity": {
    "name": "Climatiq",
    "purpose": "Calculate the environmental footprint created by a broad range of emission-generating activities"
  },
  "offers": [
    {
      "intent": "use_api",
      "description": "가상의 기본 엔드포인트: https://docs.climatiq.io",
      "endpoint": "/",
      "method": "GET",
      "side_effect": "read-only",
      "auth_type": "api_key",
      "confidence_score": 0.5
    }
  ],
  "needs": [
    {
      "intent": "identity.api_key",
      "criticality": "required"
    }
  ]
}