{
  "id": "ipinfodb",
  "protocol_version": "0.2.0",
  "identity": {
    "name": "IPInfoDB",
    "purpose": "Free Geolocation tools and APIs for country, region, city and time zone lookup by IP address"
  },
  "offers": [
    {
      "intent": "use_api",
      "description": "가상의 기본 엔드포인트: https://www.ipinfodb.com/api",
      "endpoint": "/",
      "method": "GET",
      "side_effect": "read-only",
      "auth_type": "api_key",
      "confidence_score": 0.5
    }
  ],
  "needs": [
    {
      "intent": "identity.api_key",
      "criticality": "required"
    }
  ]
}