{
  "id": "covid-id",
  "protocol_version": "0.2.0",
  "identity": {
    "name": "COVID-ID",
    "purpose": "Indonesian government Covid data per province"
  },
  "offers": [
    {
      "intent": "use_api",
      "description": "가상의 기본 엔드포인트: https://data.covid19.go.id/public/api/prov.json",
      "endpoint": "/",
      "method": "GET",
      "side_effect": "read-only",
      "auth_type": "api_key",
      "confidence_score": 0.5
    }
  ],
  "needs": [
    {
      "intent": "identity.api_key",
      "criticality": "required"
    }
  ]
}