{
  "id": "clickup",
  "protocol_version": "0.2.0",
  "identity": {
    "name": "ClickUp",
    "purpose": "ClickUp is a robust, cloud-based project management tool for boosting productivity"
  },
  "offers": [
    {
      "intent": "use_api",
      "description": "가상의 기본 엔드포인트: https://clickup.com/api",
      "endpoint": "/",
      "method": "GET",
      "side_effect": "read-only",
      "auth_type": "api_key",
      "confidence_score": 0.5
    }
  ],
  "needs": [
    {
      "intent": "identity.api_key",
      "criticality": "required"
    }
  ]
}