{
  "id": "trakt",
  "protocol_version": "0.2.0",
  "identity": {
    "name": "Trakt",
    "purpose": "Movie and TV Data"
  },
  "offers": [
    {
      "intent": "use_api",
      "description": "가상의 기본 엔드포인트: https://trakt.docs.apiary.io/",
      "endpoint": "/",
      "method": "GET",
      "side_effect": "read-only",
      "auth_type": "api_key",
      "confidence_score": 0.5
    }
  ],
  "needs": [
    {
      "intent": "identity.api_key",
      "criticality": "required"
    }
  ]
}