{
  "id": "biomedical-information-extraction",
  "protocol_version": "0.2.0",
  "identity": {
    "name": "Biomedical Information Extraction",
    "purpose": "How to extract information from unstructured biomedical data and text."
  },
  "offers": [
    {
      "intent": "use_api",
      "description": "가상의 기본 엔드포인트: https://github.com/caufieldjh/awesome-bioie#readme",
      "endpoint": "/",
      "method": "GET",
      "side_effect": "read-only",
      "auth_type": "api_key",
      "confidence_score": 0.5
    }
  ],
  "needs": [
    {
      "intent": "identity.api_key",
      "criticality": "required"
    }
  ]
}