{
  "id": "epa",
  "protocol_version": "0.2.0",
  "identity": {
    "name": "EPA",
    "purpose": "Web services and data sets from the US Environmental Protection Agency"
  },
  "offers": [
    {
      "intent": "use_api",
      "description": "가상의 기본 엔드포인트: https://www.epa.gov/developers/data-data-products#apis",
      "endpoint": "/",
      "method": "GET",
      "side_effect": "read-only",
      "auth_type": "api_key",
      "confidence_score": 0.5
    }
  ],
  "needs": [
    {
      "intent": "identity.api_key",
      "criticality": "required"
    }
  ]
}